{
  "manufacturer_id": "0x564C",
  "manufacturer": "Vari-Lite, Inc.",
  "source": "VL3600 Profile IP Series user manual, section 4 'RDM Parameter IDs' (https://vari-lite.s3.eu-west-1.amazonaws.com/manuals/vl3600-profile-ip-series-users.pdf); model IDs 0x003E VL3600 Profile IP and 0x0042 VL3600 LT Profile IP. The manual names these in prose ('Output Power Mode'); the names here are that wording in upper snake case. Settable from the GET/SET columns (0x8AAF and 0x8AB0 are SET-only). The manual gives no data types; where it says 'value range depends on options' the PID is an enumeration, but no value labels are printed. The Art-Net PIDs 0x8AB2–0x8AB6 are marked in the manual as superseded by the E1.37-2 0x07xx set, and 0x8AAC by the E1.37-1 0x03xx set.",
  "pids": [
    { "pid": "0x8A97", "name": "OUTPUT_POWER_MODE", "settable": true },
    { "pid": "0x8AA0", "name": "DISPLAY_ON_TIME", "settable": true },
    { "pid": "0x8AA1", "name": "LED_DIMMER_CURVE", "settable": true },
    { "pid": "0x8AA2", "name": "PAN_TILT_MOVEMENT", "settable": true },
    { "pid": "0x8AA3", "name": "HEAD_MOTOR_MOVEMENT", "settable": true },
    { "pid": "0x8AA4", "name": "AUTO_SHUTDOWN_MODE", "settable": true },
    { "pid": "0x8AA5", "name": "LED_HOURS", "settable": true },
    { "pid": "0x8AA6", "name": "DIM_SNAP", "settable": true },
    { "pid": "0x8AA7", "name": "COLOR_SNAP", "settable": true },
    { "pid": "0x8AA8", "name": "AUTO_FAN_MODE", "settable": true },
    { "pid": "0x8AA9", "name": "GAMMA_SHIFT", "settable": true },
    { "pid": "0x8AAA", "name": "TUNGSTEN_DIMMING", "settable": true },
    { "pid": "0x8AAB", "name": "CTB_CORRECTION", "settable": true },
    { "pid": "0x8AAC", "name": "LED_REFRESH_RATE", "settable": true },
    { "pid": "0x8AAD", "name": "SIDE_HANG", "settable": true },
    { "pid": "0x8AAE", "name": "FOCUS_TRACK", "settable": true },
    { "pid": "0x8AAF", "name": "CONTROL_SIGNAL_SELECT", "settable": true },
    { "pid": "0x8AB0", "name": "RECALIBRATE_FIXTURE", "settable": true },
    { "pid": "0x8AB1", "name": "DMX_FAIL", "settable": true },
    { "pid": "0x8AB2", "name": "ARTNET_UNIVERSE", "settable": true },
    { "pid": "0x8AB3", "name": "ARTNET_NET", "settable": true },
    { "pid": "0x8AB4", "name": "ARTNET_SUBNET", "settable": true },
    { "pid": "0x8AB5", "name": "ARTNET_ETHERNET_IP", "settable": true },
    { "pid": "0x8AB6", "name": "ARTNET_ETHERNET_SUBNET_MASK", "settable": true },
    { "pid": "0x8AB7", "name": "MANUAL_PRESET_PLAYBACK_POWER_UP_PRESET", "settable": true },
    { "pid": "0x8AB8", "name": "MANUAL_PRESET_PLAYBACK_PRESET_INTENSITY", "settable": true },
    { "pid": "0x8AB9", "name": "MANUAL_PRESET_PLAYBACK_PRIORITY", "settable": true },
    { "pid": "0x8ABA", "name": "MANUAL_PRESET_PLAYBACK_POWER_UP", "settable": true },
    { "pid": "0x8ABB", "name": "LED_COLOR_CALIBRATION", "settable": true },
    { "pid": "0x8AD3", "name": "PAN_TILT_FEEDBACK", "settable": true }
  ]
}
