{
  "manufacturer_id": "0x4D50",
  "manufacturer": "Martin Professional A/S",
  "source": "MAC Viper XIP User Manual Revision G, chapter 'RDM functions' (https://www.martin.com/en-US/site_elements/martin-manuals-mac-viper-xip-user-safety-and-installation-manual). Names verbatim; settable from the table's GET/SET columns. The manual gives no data types. The MAC Viper Performance User Guide Rev C and MAC Viper Profile User Guide Rev D (2012) print no PID table — they say to ask the fixture through SUPPORTED_PARAMETERS / PARAMETER_DESCRIPTION — so which of these a Viper Performance implements is unconfirmed.",
  "pids": [
    { "pid": "0x8001", "name": "DMX_RESET", "settable": true },
    { "pid": "0x8003", "name": "FIXTURE_ID", "settable": true },
    { "pid": "0x8004", "name": "COLOR_MODE", "settable": true },
    { "pid": "0x8101", "name": "SYNCHRONIZED", "settable": true },
    { "pid": "0x810B", "name": "PRESET_PLAYBACK_LIMIT", "settable": true },
    { "pid": "0x810C", "name": "OFFLINE_MODE", "settable": true },
    { "pid": "0x810D", "name": "STAND-ALONE_CTRL_MODE", "settable": false },
    { "pid": "0x8220", "name": "MANUAL_MODE_OVERRIDE", "settable": true },
    { "pid": "0x8301", "name": "EFFECT_SPEED", "settable": true },
    { "pid": "0x8302", "name": "EFFECT_SHORTCUTS_ENABLE", "settable": true },
    { "pid": "0x8308", "name": "DISPLAY_ERRORS_ENABLE", "settable": true },
    { "pid": "0x8310", "name": "DIMMER_CURVE", "settable": true },
    { "pid": "0x8311", "name": "FOCUS_TRACKING", "settable": true },
    { "pid": "0x8312", "name": "DISPLAY_AUTO_OFF", "settable": true },
    { "pid": "0x8325", "name": "VIDEO_TRACKING", "settable": true },
    { "pid": "0x8326", "name": "DISPLAY_CONTRAST", "settable": true },
    { "pid": "0x8329", "name": "HIBERNATION_MODE", "settable": true },
    { "pid": "0x832A", "name": "TUNGSTEN_MODE", "settable": true },
    { "pid": "0x832D", "name": "GOBO_CT_CORRECTION", "settable": true },
    { "pid": "0x8330", "name": "STUDIO_MODE", "settable": true },
    { "pid": "0x8331", "name": "KEYLIGHT_CALIBRATION", "settable": true },
    { "pid": "0x8337", "name": "OUTDOOR_ACTIONS", "settable": true },
    { "pid": "0x833E", "name": "FRAMING_MODE", "settable": true },
    { "pid": "0x8400", "name": "PAN_TILT_SPEED", "settable": true },
    { "pid": "0x8402", "name": "PAN_TILT_LIMITATION_ENABLE", "settable": true },
    { "pid": "0x8403", "name": "PAN_LIMITATION_MINIMUM", "settable": true },
    { "pid": "0x8404", "name": "PAN_LIMITATION_MAXIMUM", "settable": true },
    { "pid": "0x8405", "name": "TILT_LIMITATION_MINIMUM", "settable": true },
    { "pid": "0x8406", "name": "TILT_LIMITATION_MAXIMUM", "settable": true },
    { "pid": "0x8409", "name": "PAN_TILT_LIMITATION_RESET", "settable": true },
    { "pid": "0x8500", "name": "FOLLOW_SPOT_MODE_ENABLE", "settable": true },
    { "pid": "0x8603", "name": "FAN_CLEAN", "settable": true },
    { "pid": "0x8604", "name": "FAN_MODE", "settable": true },
    { "pid": "0x8700", "name": "SERIAL_NUMBER", "settable": false },
    { "pid": "0x870A", "name": "DEVICE_HOURS_TOTAL", "settable": false },
    { "pid": "0x870B", "name": "LAMP_HOURS_TOTAL", "settable": false },
    { "pid": "0x870C", "name": "POWER_CYCLES_TOTAL", "settable": false }
  ]
}
